,S/No.,Date,Closing Price,Headline 1,Headline 2,Headline 3,Headline 4,Headline 5,Headline 6
194,68,09/30/2019,1473.72,"gold lingers near 2-month low, robust dollar weighs","platinum, gold slide as dollar soars; palladium eases off record","palladium breaks through $1,700 on supply concerns; dollar pressures gold","gold dips as u.s.-china trade woes support dollar, palladium hits record high",#N/A,#N/A
195,67,10/01/2019,1481.82,gold inches up as weak u.s. data reinforces economic slowdown fears,gold bounces off two-month lows on weaker u.s. data,gold dips on strong dollar and optimism over trade deal,gold slips as robust dollar dents appeal,#N/A,#N/A
196,66,10/02/2019,1500.11,gold rises as weak u.s. data fuels global slowdown worries,gold climbs over 1% as weak u.s. data feeds economic fears,gold rises as global growth worries boost safe-haven appeal,gold edges higher as u.s. data fans slowdown fears,#N/A,#N/A
197,65,10/03/2019,1508.4,"gold gains on soft u.s. service sector data, focus on jobs report",gold gains 1% as poor u.s. data ignites growth worries,gold rises as u.s. tariffs on eu boost safe-haven bets,gold prices steady as market awaits u.s. employment report,#N/A,#N/A
198,64,10/04/2019,1504.81,"gold pares gains after decent jobs data, still set for weekly gain","gold gains on global growth fears, eyes on u.s. jobs data",gold gains on economic fears; investors focus on jobs report,#N/A,#N/A,#N/A
199,63,10/07/2019,1492.11,gold edges lower as dollar strengthens ahead of trade talks,"gold treads water as focus shifts to sino-u.s. talks, fed minutes",gold eases as dollar firms; caution sets in ahead of trade talks,gold edges up ahead of sino-u.s. trade talks,#N/A,#N/A
200,62,10/08/2019,1508.8,gold firms as u.s.-china trade dispute worsens ahead of talks,"gold rises as risk sentiment sours on trade, brexit uncertainty",gold gains as risk sentiment wanes ahead of u.s.-china talks,gold dips as dollar holds strong ahead of sino-u.s. trade talks,#N/A,#N/A
201,61,10/09/2019,1514.59,gold at one-week high as trade talk hopes fade,gold perks up ahead of fed minutes despite trade optimism,gold eases on renewed u.s.-china trade optimism,gold holds firm as optimism fades for u.s.-china trade talks,#N/A,#N/A
202,60,10/10/2019,1494.1,refile-gold inches lower as trump's remarks boost trade talk hopes,"gold slips, palladium hits record high on trade deal hopes",gold inches up as anxious investors await sino-u.s. talks,gold rises to one-week peak amid trade anxiety,#N/A,#N/A
203,59,10/11/2019,1489.8,"gold falls over 1% as brexit, sino-u.s. trade worries ease","gold slides as safe-haven demand dips on brexit, sino-u.s. trade hopes","gold climbs as investors await concrete signals on trade, brexit",#N/A,#N/A,#N/A
204,58,10/14/2019,1491.34,gold steady ahead of crucial brexit talks,"gold rebounds as trade deal hopes fade, palladium hits record",gold rises as stocks pull back on waning trade deal optimism,gold eases as stock markets cheer trade optimism,#N/A,#N/A
205,57,10/15/2019,1482,gold edges higher as brexit uncertainty spurs safe-haven bid,gold slips 1% on stronger equities; palladium smashes record,"gold steadies before brexit summit, palladium hits record high","gold steady as trade optimism ebbs, palladium hits record high",#N/A,#N/A
206,56,10/16/2019,1490.13,gold steady as disappointing u.s. retail sales weigh on risk appetite,"gold climbs, eyes u.s.-china ties; palladium bolts to record","gold firms, eyes u.s.-china ties; palladium bolts to record","gold steadies as equities ease on brexit anxiety, palladium soars","gold inches up on brexit jitters, risk-on mood limits gains",#N/A
207,55,10/17/2019,1492.89,"gold steady as brexit deal lifts stocks, pressures dollar",gold rises as growth concerns resurface; palladium surges,gold steadies with focus on trade talks; palladium breaks new records,gold steady ahead of brexit talks; weak u.s. data lends support,#N/A,#N/A
208,54,10/18/2019,1490.25,"gold steadies as concerns on brexit, trade war linger","gold eases on brexit deal, global growth concerns limit losses","gold dips on profit-taking, trade uncertainties cap losses",#N/A,#N/A,#N/A
209,53,10/21/2019,1484.23,gold eases as trade-deal hopes lift risk mood,gold prices inch down on upbeat risk sentiment,"gold steady as markets seek clarity on brexit, u.s-china trade talks","gold flat as markets eye trade talk cues, brexit deal",#N/A,#N/A
210,52,10/22/2019,1488.91,gold bides time as traders await clarity on brexit,"gold holds tight range ahead of key brexit vote, focus on fed",gold firms on brexit jitters but trade optimism caps gains,gold firm ahead of brexit vote but risk mood caps gains,#N/A,#N/A
211,51,10/23/2019,1492.21,"gold steady as investors await brexit clarity, fed meeting","gold gains on brexit jitters, market eyes fed meeting","gold rises as stocks ease on brexit, tech concerns",gold holds steady amid brexit uncertainties; technical buying gives support,#N/A,#N/A
212,50,10/24/2019,1502.81,gold hits 2-week high as weak u.s. data boosts rate-cut bets,corrected-gold gains on rate-cut bets; platinum hits over 3-week high,gold muted as investors eye ecb meet; platinum holds above $900,gold edges down as investors await clarity on brexit,#N/A,#N/A
213,49,10/25/2019,1504.44,gold pares gains as trade optimism lifts stocks; palladium surges,"gold set for best week in five, palladium sets record high",gold hits two-week high on weak u.s. data; palladium scales new peak,#N/A,#N/A,#N/A
214,48,10/28/2019,1491.81,"gold steady as trade talks progress, markets await fed's rate decision","scarce palladium scales $1,800/oz peak; gold dips as equities soar","gold eases as u.s.-china trade talks advance, fed meeting looms",gold edges up as markets eye fed's decision on rates,#N/A,#N/A
215,47,10/29/2019,1487.39,gold steady on potential trade delay; focus on fed rate decision,gold falls to 1-week low on trade optimism; focus on fed,"gold falls on stronger dollar, markets await fed meeting",gold subdued as equities jump on trade hopes; focus on fed,#N/A,#N/A
216,46,10/30/2019,1495.37,"gold inches up on fed rate cut cheer, sombre dollar",gold gains ahead of fed; palladium hits record high,gold firms as investors await fed verdict,gold prices rise as investors await fed verdict,gold prices range-bound ahead of expected fed rate cut,#N/A
217,45,10/31/2019,1512.25,gold set for second weekly rise on trade deal uncertainties,"gold gains 1% propped up by u.s. interest rate cut, trade talk woes",gold gains on dollar weakness and trade uncertainty,gold gains as dollar weakens after fed's interest rate cut,#N/A,#N/A
218,44,11/01/2019,1513.9,"gold slips on positive u.s. jobs, china factory data",gold eases as china factory data whets risk appetite,gold eases as strong china factory data prompts profit booking,#N/A,#N/A,#N/A
219,43,11/04/2019,1506.8,gold prices slip as dollar climbs on trade deal optimism,gold eases on upbeat risk sentiment,"gold eases on stronger equities, u.s.-china trade optimism",gold steady on weak dollar; trade optimism lifts risk mood,#N/A,#N/A
220,42,11/05/2019,1484.31,gold firms as markets await clarity on trade talks,gold faces biggest fall in over a month as trade hopes revive,gold slips as trade deal hopes fuel risk appetite,gold eases as u.s.-china trade deal hopes boost dollar,#N/A,#N/A
221,41,11/06/2019,1490.34,gold little changed as investors seek clarity on trade negotiations,gold prices gain on u.s.-china trade deal jitters,"gold firms as stocks pause, trade uncertainty lingers",gold inches up as markets await cues on trade deal,#N/A,#N/A
222,40,11/07/2019,1468.79,"gold hovers near 1-month low after china, u.s. agree on tariff roll-back",gold slumps to 1-month low on u.s.-china tariff rollback,gold eases as trade deal hopes whet risk appetite,gold eases as positive trade news boosts risk sentiment,#N/A,#N/A
223,39,11/08/2019,1458.7,"gold hits 3-month low, faces biggest weekly drop in 3 years",gold set for biggest weekly drop in 3 years on trade optimism,gold inches up on u.s.-china trade deal uncertainty,#N/A,#N/A,#N/A
224,38,11/11/2019,1455.72,gold flat as investors shift focus to trump speech,gold slips to over 3-month low as equities rise on 'risk-on' sentiment,"gold rises on trade war doubts, weak stocks on hong kong turmoil","gold rises on trade deal uncertainty, economic slowdown, hk violence",#N/A,#N/A
225,37,11/12/2019,1458.49,"gold hit by uncertainty over u.s.-china trade deal, firmer dollar",gold prices dip on upbeat appetite for riskier assets,gold eases as hopes of u.s.-china trade progress lift risk appetite,gold edges down as market turns optimistic on trade negotiations,#N/A,#N/A
226,36,11/13/2019,1463.65,gold inches down as hawkish fed weighs on safe-haven demand,gold rises as trade deal doubts pressure equities,gold rises as trade uncertainty hurts risk appetite,gold firms as doubts over u.s.-china trade deal curb risk appetite,#N/A,#N/A
227,35,11/14/2019,1469.3,refile-gold falls as u.s.-china trade pact hopes spur risk appetite,"gold rises on waning trade deal hopes and dip in equities, dollar","gold gains as risk appetite falters, trade optimism sours",gold gains as weak china data dents risk appetite,#N/A,#N/A
228,34,11/15/2019,1468,gold slips as trade optimism derails safe-haven demand,gold slips as u.s.-china deal hopes cheer stock markets,gold falls as u.s.-china trade deal hopes whet risk appetite,#N/A,#N/A,#N/A
229,33,11/18/2019,1471.83,gold rises as sino-u.s. trade deal doubts resurface,gold erases losses as u.s.-china trade hopes ebb,gold slips as u.s.-china trade deal optimism boosts equities,gold prices dip on optimism over u.s.-china trade deal,#N/A,#N/A
230,32,11/19/2019,1474.5,"gold rises as sino-u.s. trade, hong kong tensions escalate",gold rebounds as impeachment inquiry uncertainty weighs on stocks,gold slips as fresh hopes for u.s.-china deal boost stocks,refile-gold prices steady as u.s.-china trade deal doubts linger,#N/A,#N/A
231,31,11/20/2019,1474.52,gold rises on uncertainty over sino-u.s. trade deal,"gold little changed after fed minutes, trade tensions lend support",gold gains as souring u.s.-china relations hit risk appetite,gold gains on u.s.-china tensions; markets eye fed minutes,#N/A,#N/A
232,30,11/21/2019,1465.23,gold steady amid mixed signals on u.s.-china trade talks,gold dips as hopes for u.s.-china trade deal re-emerge,gold eases as china invites u.s. officials for talks,gold steady on concerns of delay in u.s.-china trade deal,#N/A,#N/A
233,29,11/22/2019,1462.36,"gold prices ease as strong u.s. data lifts dollar, yields",gold rises as 'phase one' trade deal doubts persist,gold gains as u.s.-china trade uncertainty lingers,#N/A,#N/A,#N/A
234,28,11/25/2019,1453.9,gold dips as china-u.s. trade optimism dents safe-haven demand,gold slides to two-week low on hopes for thaw in trade feud,gold dips as trade deal optimism benefits riskier assets,gold slips as trade deal optimism boosts riskier assets,#N/A,#N/A
235,27,11/26/2019,1460.66,gold eases as trump's remarks boost trade deal hopes,gold edges off 2-week lows as sino-u.s. trade caution lingers,gold steadies near two-week low as focus remains on u.s.-china talks,gold steadies on doubts over progress in u.s.-china trade talks,#N/A,#N/A
236,26,11/27/2019,1457.1,gold gains as u.s. bill backing hk protesters fuels trade deal doubts,gold drops as trade deal hopes boost wall street to record,"gold softens as trade deal signs boost equities, dollar","gold slips as trump says u.s., china close to trade deal",#N/A,#N/A
237,25,11/28/2019,1456.15,gold eyes worst month in 3 years amid trade deal hopes,gold treads water as investors assess u.s.-china trade developments,gold gains as hong kong tensions fuel trade deal doubts,#N/A,#N/A,#N/A
238,24,11/29/2019,1463.96,gold faces worst month since june 2018; markets seek clarity on trade talks,gold steadies as trade doubts persist; faces worst month in 3-years,gold little changed amid trade deal doubts; set for worst month in 3 years,#N/A,#N/A,#N/A
239,23,12/02/2019,1462.75,gold inches up as trump's latin american tariffs curb risk appetite,"gold steadies after weak u.s. data; palladium zooms past $1,860/oz","gold slips on strong chinese data, palladium soars to new record","gold slips on firm dollar, positive china factory data",#N/A,#N/A
240,22,12/03/2019,1476.83,gold hovers near 1-month peak as trade concerns linger,gold jumps over 1% as trump says trade deal could extend to 2020,advisory-alert on spot gold wrongly coded to french utility edf,gold scales over 1-week peak on increasing global trade tensions,gold prices tread water despite trump's latam tariffs,#N/A
241,21,12/04/2019,1475.62,gold steady as dollar weakens on dour u.s. data,"gold retreats as trade optimism resurfaces, palladium soars",gold steadies as investors await clarity on u.s.-china trade,gold hits near 1-month high as trade drag prompts safety buying,#N/A,#N/A
242,20,12/05/2019,1476.04,refile-gold flat as risk sentiment rises on trade optimism; set for a weekly rise,rpt-gold firms as u.s.-china trade uncertainty persists,gold firms as u.s.-china trade uncertainty persists,gold unchanged as u.s.-china trade uncertainty persists,gold prices steady on mixed u.s.-china trade signals,#N/A
243,19,12/06/2019,1460.12,gold slips 1% after robust u.s. jobs data; palladium soars,gold steadies on trade optimism ahead of u.s. jobs data,"gold falls on china tariff move, but set for a weekly gain",#N/A,#N/A,#N/A
244,18,12/09/2019,1461.2,"gold steady ahead of fed meet, awaits clarity on fresh u.s. tariffs","palladium eyes $1,900 in record surge; gold firms on trade doubts",gold gains as trade tariff deadline looms,gold inches up on u.s.-china trade uncertainty; fed meet in focus,#N/A,#N/A
245,17,12/10/2019,1464,"gold range-bound ahead of fed decision, tariff deadline","palladium breaches $1,900 ceiling after south africa outages",gold firms as trade deadline nears; investors await fed verdict,"gold little changed ahead of fed meeting, u.s. tariff deadline",#N/A,#N/A
246,16,12/11/2019,1474.7,gold holds overnight gains after fed keeps rates steady,"gold rises 1% after fed stands pat on rates, curbs hike hopes",gold firms ahead of tariff deadline and central bank decisions,"gold stalls ahead of fed policy statement, tariffs deadline",#N/A,#N/A
247,15,12/12/2019,1465.11,gold prices slip as trade euphoria lifts risk appetite,gold down after trump says close to trade deal,gold holds steady as tariff deadline nears,gold little changed as u.s. tariff deadline approaches,#N/A,#N/A
248,14,12/13/2019,1475.64,gold gains as lack of details on trade deal lifts demand,gold remains below one-month peak as shares soar on trade relief,gold steady as weaker dollar offsets effect of rising equities,#N/A,#N/A,#N/A
249,13,12/16/2019,1475.41,gold on hold as sino-u.s. trade uncertainty persists,gold steadies as trade uncertainties linger,gold steadies as investors seek clarity on u.s.-china trade deal,"gold steadies as dollar dips, traders await trade deal fineprint",#N/A,#N/A
250,12,12/17/2019,1475.7,gold steady as trade deal doubts offset positive u.s. data,"gold steadies; palladium retreats after surge toward $2,000/oz","palladium eases after record run towards $2,000","gold steady as markets crave trade details; palladium eyes $2,000/oz",#N/A,#N/A
251,11,12/18/2019,1475.84,gold gains as u.s. house votes to impeach trump,"gold dips as dollar rises; palladium falls back from near $2,000","gold dips on stronger dollar, palladium pulls back from high",gold muted as investors await trade deal details; palladium falls,#N/A,#N/A
252,10,12/19/2019,1478.5,gold inches lower on trade optimism; all eyes on u.s. gdp data,gold firms as markets await more details on trade deal,gold eases as trade optimism offsets u.s. political uncertainty,gold inches up as trump impeachment stokes political uncertainty,#N/A,#N/A
253,9,12/20/2019,1478.15,palladium drops over 5% as investors lock in profits; gold subdued,gold stalls as trade progress weighs on safe-haven demand,gold edges down as trade progress supports riskier assets,#N/A,#N/A,#N/A
254,8,12/23/2019,1485.56,"gold holds ground on weak u.s. data, trade deal concerns",gold firms on sparse trade as economic concerns support,gold rises on trade uncertainty in thin turnover,gold gains in pre-holiday trade on doubts over china-u.s. deal,#N/A,#N/A
255,7,12/24/2019,1498.18,"gold breaks above $1,500 on growth fears, stock market highs",gold scales 1-1/2 month peak on sombre u.s. economic data,gold prices rise on soft u.s. data and trade concerns,#N/A,#N/A,#N/A
256,6,12/25/2019,1499.55,gold steady as markets await trade deal signing details,#N/A,#N/A,#N/A,#N/A,#N/A
257,5,12/26/2019,1511.16,gold eases as stocks gain; set for best weekly jump in over 4 months,gold rises to near 2-month high in thin holiday trade,gold prices climb as trade deal concerns linger,"corrected-gold rises above $1,500 level as investors await trade deal signing",#N/A,#N/A
258,4,12/27/2019,1511.08,"gold inches up, on track for best week in four months",gold holds steady near two-month peak in slow year-end trading,gold slips from 2-month high on profit-taking; eyes best week in 4 months,#N/A,#N/A,#N/A
259,3,12/30/2019,1515.02,"gold prices steady, set for best year since 2010",gold inches up on growth concerns as dollar dips,"gold hits 2-month peak on dollar weakness, u.s. air strikes","gold hits 2-mth peak on dollar weakness, u.s. air strikes",#N/A,#N/A
260,2,12/31/2019,1517.24,golden year for precious metals as 2019 sees glistening run,"gold gains, set for biggest yearly rise since 2010",gold at 3-month peak; set for biggest annual rise since 2010,gold climbs to 3-month peak; set for biggest annual rise since 2010,"gold climbs to 3-month high, poised for best year since 2010",#N/A
261,522,01/01/2020,1518.41,gold prices edge higher on soft dollar,#N/A,#N/A,#N/A,#N/A,#N/A
262,521,01/02/2020,1528.95,"gold edges up on weaker dollar, set for 4th weekly gain",gold races to 3-month peak on doubts over stocks rally,"gold rises back towards 3-month high, markets eye fed minutes",gold prices inch higher on u.s. dollar weakness,#N/A,#N/A
263,520,01/03/2020,1552.24,gold jumps to 4-month peak as middle east tensions spark safety buying,gold rallies to 4-month high after u.s. air strike in baghdad,gold jumps 1% as mideast tensions spur safe-haven bid,#N/A,#N/A,#N/A
264,519,01/06/2020,1563.83,gold slips from near 7-year high as u.s.-iran tensions ease,gold soars as middle east tensions brew 'perfect storm',gold powers towards 7-year peak as investors rush for safety,"gold rises to near 7-year high on u.s.-iran conflict; palladium breaches $2,000",#N/A,#N/A
265,518,01/07/2020,1595.24,"gold soars past $1,600/ounce after iran attack on u.s. forces","gold edges up, but trades below 7-year peak as middle east worries ebb",corrected (official)-gold soars as middle east tensions brew 'perfect storm' (jan. 6),gold slips from near 7-year high on lull in u.s.-iran tensions,gold prices edge higher as u.s.-iran tensions persist,#N/A
266,517,01/08/2020,1557.89,gold little changed as fears of larger u.s.-iran conflict ease,gold tumbles as trump allays middle east worries,gold eases off 7-year peak as middle east worries abate,"gold below $1,600 as markets await u.s. reaction to iran attacks",gold races to near 7-year peak after iran strike on u.s. forces,#N/A
267,516,01/09/2020,1552.72,gold inches down as easing u.s.-iran tensions whet risk appetite,gold's rally fizzles on de-escalating u.s.-iran tensions,gold slides from near 7-year peak as u.s.-iran fears subside,gold drops from 7-year highs as u.s.-iran worries abate,#N/A,#N/A
268,515,01/10/2020,1562.05,"gold firms on renewed u.s.-iran tensions, eyes fifth weekly gain",gold extends fall as fading middle east tensions boost risk appetite,gold inches lower amid rising equities as mideast tensions fade,#N/A,#N/A,#N/A
269,514,01/13/2020,1545.44,gold falls ahead of u.s.-china trade deal on improved risk appetite,"gold slips as risk-on sentiment weighs, trade deal in view",gold slips 1% ahead of u.s.-china trade deal,gold slips as asian equities rise ahead of sino-u.s. trade deal,#N/A,#N/A
270,513,01/14/2020,1549.6,gold inches up as u.s. says china tariffs in place till phase 2 deal,"gold dips as trade deal signing nears, palladium hits record high","gold dips ahead of u.s.-china deal, palladium hits record high","gold dips to near 2-week low on solid china data, trade deal optimism",#N/A,#N/A
271,512,01/15/2020,1556.35,gold steady as uncertainties linger after u.s.-china trade deal,gold firms as u.s.-china trade deal details fail to allay uncertainty,gold rises on u.s.-china trade concerns; platinum hits near 2-year peak,gold gains as investors doubt impact of u.s.-china phase 1 deal,#N/A,#N/A
272,511,01/16/2020,1552.27,"gold eases on demand for riskier assets, set for worst week in 2 months","gold slips as signing of trade deal, u.s. data prop up stock markets","gold steadies after u.s.-china deal, palladium jumps over 5%",gold inches down as u.s.-china trade deal stokes risk-taking,#N/A,#N/A
273,510,01/17/2020,1557.3,"palladium's relentless rally pushes it above $2,500 an ounce",gold edges higher but faces first weekly decline in six,gold firm but on track for biggest weekly fall in 2 months,#N/A,#N/A,#N/A
274,509,01/20/2020,1561.31,gold hits 2-week high on safe-haven demand,"gold gains on heightened safe-haven interest, palladium soars","gold gains on yemen attacks, china lunar new year buying",#N/A,#N/A,#N/A
275,508,01/21/2020,1556.56,gold eases as markets assess risks from china virus,"gold falls 1% after hitting two-week high but stays above $1,550",gold eases off 2-week peak; safe haven demand limits declines,gold climbs to 2-week high as china flu scare spurs safe-haven bids,#N/A,#N/A
276,507,01/22/2020,1561.45,gold steady as fears of china virus epidemic mount,gold slips on resurgent risk appetite as virus fears ebb,gold holds steady on central bank policy expectations,gold slips as dollar gains and china steps up virus countermeasures,#N/A,#N/A
277,506,01/23/2020,1561.04,gold eases after who says china virus not a global emergency,gold firms as risk appetite wanes on coronavirus fears,gold steadies as risk sentiment sours on virus threat,"gold dips on profit-taking, rate expectations cap losses",gold prices inch lower as markets eye ecb decision,#N/A
278,505,01/24/2020,1571.56,gold scales two-week peak as virus fears fuel safe-haven bids,gold eases as who tempers virus fears,gold inches lower as investors seek clarity on virus severity,#N/A,#N/A,#N/A
279,504,01/27/2020,1581.17,gold steady as china virus fears offset stronger dollar,gold hits three-week high as virus fears spur flight to safety,gold gains 1% as virus fears fan growth worries,gold climbs to 2-week high as virus fears spark safety buying,#N/A,#N/A
280,503,01/28/2020,1568.59,"gold steady as markets gauge virus impact, await fed decision","gold dips as stocks recover, dollar gains ahead of fed meeting",gold eases off 3-week peak as equities sell-off pauses,gold eases ahead of fed meeting; virus fears persist,#N/A,#N/A
281,502,01/29/2020,1577.2,gold edges up as fed flags coronavirus concerns,"gold rises as virus woes persist, focus shifts to fed","gold gains as virus concerns linger, investors await fed",gold inches up as virus fears mount; markets await fed decision,#N/A,#N/A
282,501,01/30/2020,1575.21,"gold eases on china data, but set for monthly gain amid virus fears",gold rises as china virus fears stoke demand for safe havens,gold holds gains on worries of coronavirus impact on world economy,gold gains as virus fuels economic worry,#N/A,#N/A
283,500,01/31/2020,1589.4,gold set for best month in five as virus stifles risk appetite,"gold gains on epidemic fears, eyes best month in five",gold inches higher on virus concerns; set for monthly gain,#N/A,#N/A,#N/A
284,499,02/03/2020,1578.96,firm dollar weighs on gold prices amid virus threats,"gold slides 1% as dollar gains, risk sentiment improves",gold retreats as china seeks to limit virus damage,"gold skids 1% on china measures, stronger dollar",#N/A,#N/A
285,498,02/04/2020,1554.04,gold prices edge higher on virus worries,gold falls 1% as china works to stem economic impact of virus,gold falls as china's virus measures boost risk appetite,"gold eases on profit-taking, virus scare limits losses",#N/A,#N/A
286,497,02/05/2020,1556.1,gold steady as virus fears offset robust u.s. data,"gold rebounds on bargain hunting, bets for loose central bank policy",gold near 2-week low after reports of anti-coronavirus drug,gold gains as coronavirus epidemic fuels safe-haven demand,#N/A,#N/A
287,496,02/06/2020,1565.89,gold inches up on virus concerns; set for worst week since early nov,gold gains on bets for low central bank rates as virus woes persist,gold gains on bets for low central bank rates as virus woes prevail,concern over coronavirus drives gold higher,gold gains as markets assess economic impact of virus,#N/A
288,495,02/07/2020,1570.41,gold gains as virus fears outweigh strong u.s. jobs data,gold steadies as virus concerns stall stock markets,gold steady as equities retreat on fears of virus impact on growth,#N/A,#N/A,#N/A
289,494,02/10/2020,1572.06,gold steady as virus fears counter firmer equities,gold climbs to 1-week peak as virus fears boost safety demand,gold gains as markets count economic toll from coronavirus,gold steadies as markets weigh severity of coronavirus outbreak,#N/A,#N/A
290,493,02/11/2020,1567.2,gold flat as risk sentiment improves on slowing virus threat,"gold slips as stronger dollar, risk-on sentiment weighs",gold inches lower as new coronavirus cases dip,gold eases from 1-week high as safe-haven demand moves to dollar,#N/A,#N/A
